아이디,댓글 내용
  시안Cyan,"학생 때 사물놀이 6년을 하면서 살짝 난청이 왔나봐요. 전화할 때 잘 못듣는 점, 마스크 때문에 입모양을 읽을 수 없어서 난감한 점, 안들리다보니 제 목소리도 작아지는 점, 그로 인해 자신감도 잃고 대화하는 걸 두려워하는 점까지.. 이번편은 너무 공감가는 부분이 많네요. 청력검사는 정상이고 난청으로 진단받은 건 아니지만 많은 분들이 저와 비슷한 어려움을 겪는다는 사실을 알게 되니까 두려움이 조금 나아지는 것 같아요."
  멍때리는루피,항상 영상 잘 보고 있습니다. 혹시 연축성발성장애 에 대해서도 다뤄주실 수 있을까요? 3년 전 발병했고 이 병 때문에 여전히 힘든 일상을 보내고 있는데요. 워낙 이해받기 쉽지 않은 병이라 조금이라도 널리 알려졌으면 하는 마음에 부탁드려봅니다.
  혜교화로운생,영상 잘 봤습니다! 이명과 난청 증상이 있어서 대학병원에 갔는데 메니에르 인 것 같다고 그러시더라구요.. 근데 어지러울 때 바로 응급실로 오라고 하셨는데 어지러웠다가 괜찮아졌다 가 반복 되어서 ..치료할 때 타이밍이 잘 맞아야 된다고 그러셨는데 타이밍을 못 잡겠어요.. ㅠㅠ 예전보다 사람들이랑 대화하면 다시 물어봐야 되는 것도 많아졌구요 고민입니다..
  김아리옹,평소에 귀가 밝은 편이라 남들이 못 듣는 바람소리나 이런 건 잘 듣는데 이상하게 사람이랑 대화하거나 통화할 때 말귀를 잘 못 알아듣겠어요.. 그래서 친구들이나 가족들이 일부러 못 알아듣는 척 하지 말라고 장난인거 다 안다고 그러는데 정말 집중을 해도 못알아듣겠어서 너무 속상해요ㅠㅠ 다들 말에 집중을 안 해서 그렇다 이러는데 코로나 때문에 마스크를 쓴 이후로 더 심해진 것 같더라구요. 저는 여태 모르고 있었는데 제가 대화를 할 때 사람 입을 보고 집중한다는 사실도 얼마 전에 깨달았어요... 주변에서 계속 짜증을 내니 저도 스트레스를 받는데 알아주는 사람은 아무도 없네요..ㅠㅠㅠ
  달콤한귤양,며칠 전에 난청 검사를 했는데... 잘 들리면서 왜 안 들린다 그러냐고 그러더라고요...ㅠㅠ 저한테 집중해서 안 듣는거라고...ㅠㅠ 부스에서 삐뽀 검사는 조용하고 집중이 되니까 다 들렸어요. 조용한 곳에서 집중하면 작은 소리까지 다 들리는데 아이들이 조금만 떠드는 곳이면 잘 못 듣거든요...ㅠㅠ 진짜 나 안 들리는 건 어디가서 얘기해야 하나요...
  KellyCali_,난청에 진짜 중요한게... 안듣고 싶어서 안듣는게 아니라 안들려서 못듣는거에요.. 그리고 종종 모르는 사람들은 듣고싶은거만 걸러듣는다고 오해해요.. 속상합니다
  하귤,혹시 돌발청 난성에 대해서도 이야기 해 주실 수 있나요??고3에 갑작스레 돌발성 난청이 와 28살이 된 지금도 아직 청력이 완전히 회복이 안되었어요…ㅜㅜ(이명 또한 계속 되고 있어요ㅜㅜ)당시 돌발성 난청은 원인이 명확하지 않다 했는데 여전히 원인불명인가요??돌발성 난청에 대해서도 다뤄주시면 감사하겠습니다!!
  령초,"항상 청력검사에서는 정상이라 나오긴 하는데, 일상생활에서는 사람들 말이 우물우물 들리거나 외계어마냥 들리고, 몇 번씩 물어보기엔 상대방이 너무 불편해 하는게 보이더라고요...코로나 때문에 마스크로 사람 입 모양이 안 보이니까 하는 말이 더 이해가 안 됐고요ㅠ전화할 때 상대 말이 잘 이해가 안 됐던 이유를 코로나 터지고 나서 확실하게 알았어요...대화할 때 상대방의 비언어적 표현과 입모양에 많이 의지하는 편이더라고요.잘 안 들려서 생긴 습관인지는 모르겠는데 깨닫고 나니 좀 충격적으로 다가왔어요.듣는 것 때문에 미치고 팔짝 뛰겠습니다ㅠㅠ"
  더러러러,03:43ㅜㅜ 쌤 웃는거 너모 귀여우심
  LT Aillialin,20대 초반에 생긴 난청을 31살돼서 치료 받기 시작해 1년째 치료 받고 있는데 와우 심어야 한다 하더라구요... 군대있을때 사격소음이랑 스트레스때문에 생겼는데 그때 치료 받을걸 싶더라구요... 약먹는거도 약먹는거지만 먹어도 피곤하면 난청 심해지구... 군대 사격 다들 조심해요... 내몸은 내가 챙겨야 합니다... 말해봐야 꾀병취급해요
  그노,가끔 SMC 암병원 지하3층에서 지나가다가 조영상 교수님 뵙는데 영상으로 보니 더 반갑네요!!
  성하,무선 이어폰 사용이 증가한 것도 난청 환자 증가에 영향이 있을거 같네요. 밖에서도 언제 어디서든 귀에 이어폰을 꽂고 다니니..
  성하,항생제 잘못 복용해도 난청이 올수 있다니 ㄷㄷ
  neo,"좀처럼 찾기 힘든, 수준 높으면서도 쉬운 좋은 내용이네요."
  danny lee,아 진짜 끝까지 정주행!젊은 친구들 난청은 안다뤄주시네요 ㅠㅠ이어폰 볼륨 왕창 올려서 듣다가 귀 망가지는 경우 많이 봄
  jiniseo,집중 해서 듣느라고 좋아요도 안 누르고 있었어요.설명을 참 잘 해주셔서 귀에 쏙쏙 들어 옵니당.다음 시간 이어폰편 많이 기대하고 기다리고 있을께요~^️^
  대학간고냉이,정확히 난청과 치매가 어떤 상관관계가 있는지도 설명해주셨으면 좋겠어요.예를 들어 ‘소리를 듣기위해 신경을 과도하게 집중하면서 스트레스가 올라가고 그로인해 뇌의 피로도가 올라가서 치매의 유발이 올라간다’ 이런식으로요. (저 예시는 저의 추측입니다.)
  한겸,돌발성난청에 대해서도 영상찍어주세요 많이들 모르시더라구요.
  베이 ベーイ,다음 영상은 이어폰 관련이군요!! 좋지 않은 이어폰 사용 습관으로 인한 문제점이나 위험성이 높다고 하는 것은 알겠는데 이미 이어폰 끼는 생활에 너무 익숙해져서ㅜㅜ 저는 잘 때도 이어폰 끼고 노래 들으면서 자는 편이거든요ㅠㅠㅠㅠ 이게 정말 안좋을 것이라는 건 알고 있지만 이제는 습관이 되어서 이어폰을 끼고 음악을 듣지 않으면 잠이 안오드라구요…ㅠ 그래도 스스로 가능한만큼 최대한 노력해서 고쳐야겠다는 생각은 항상 듭니다ㅜㅜㅜㅜㅜㅜ 다음 영상 너무 기다려지네요ㅠ
  [은하루]eunharu,이관기능장애에 대해서도 다뤄주시면 안될까요???
  시월,안녕하세요! 항상 재밌게 보고 있습니다..!저는 부주상골증후군 (발에 뼈가 하나가 더 있는 증후군)을 가지고 있는 사람입니다..! 저도 30년을 모르고 지내다가 우연찮게 발 엑스레이를 찍고나서 알게 되었어요..오래 걷거나 뛰거나 제자리뛰기(줄넘기…) 같은 운동은 전혀 할 수가 없어서 너무 힘이 듭니다…ㅠㅠ혹시 부주상골증후군과 관련된 정보에 대해서 영상으로 다뤄주실 수 있을까요?  항상 좋은 의학 이야기 다뤄주셔서 감사합니다~!!
  Minju Kim,"선생님들, 얼마전에 다이어트 제약 업계의 게임체인저가 될 거라는 마운자로가 fda승인을 받고 1년 뒤에 한국에도 들어올 거라고 하는데요, 삭센다와 비슷한 기전이면서도 그 효과가 훨씬 커서 이제 비만은 평정되었다는 말까지 나오던데 이 마운자로에 대해 한 번만 다뤄주실 수 있을까요?"
  나는지금힐링중,이관개방증에대해서 다뤄주시면 안될까요 ㅠㅠ
  modangirl,부모님 두분이 작업환경이 시끄러운 곳에서 일하셔서 크게 소리쳐야 알아들으실 정도예요. 어머니는 어디서 이상한 보청기를 가지고 오셔서 끼신지 몇년되셨는데 전보다 더 안들리시는듯 해요. 부모님이 귀가 점점 안들리시는거 같으면 무엇부터 해야하나요? 이비인후과를 먼저 가야하나요? 보청기전문점?에 가야하나요? 보청기는 어떻게 고르고 주의해야 할점이 있을까요?
  An H,"이소골이경화증 이란 전음성난청도 설명해주실수 잇나요ㅠㅠ 아직 수술하기에는 완전히 이석화되지 않앗다는데 증상완화 할 수 잇는 방법이 잇는지, 수술을 하게 될 경우 하는 게 좋은지 궁금해요"
  Lucy Ter(루시테르),"돌발성 난청은 검사를 해도 원인을 모른다 하던데, 보청기도 소용 없을거라 말씀하시고.코로나 이전까지는 그래도 괜찮았는데 정말 마스크 때문에 의사소통에 문제가 생겨서 엄청 불편해요.난청있는 귀로는 전화 받아야지 라는 생각은 하지도 않아요.차라리 난청 온 귀가 아무 소리도 안 들리면 좋았을텐데, 마치 라디오 주파수 안 맞은 것처럼 이명이 너무 심해요.덕분에 회사에선 말 안듣는 사람 되버렸고, 안 들린다고 이야기 해도 제대로 기억해주는 사람 없고, 귀좀 파! 라는 소리만 매일 들어요ㅋㅋ스트레스 관리를 꾸준히 해주고 늦잠 자는 버릇도 고치고 해서, 아주 조금, 정말 조금 나아지기는 했는데 더 효과적인 방법이 있을까요?하도 주변 사람들이 뭐라 하니까, 지금이라도 병원을 꾸준히 다녀야하나 고민이 되네요."
  강민지,메니에르 재발로 계속 난청이 떨어졌다 좋아졌다 하는데 계속 떨어진 상태면 수술로도 좋아질 수 있나요??
  윤2,전 30중반에 난청 진단 받았는데요. 물론 이명도 같이 있구요. 회사에서 업무볼때 참 불편하고 여러명과 대화할때와 목소리가 작은사람은 듣지못 합니다. 오래되서 생활불편은 감안하고 사는데 치매와 상관관계라니..ㅠ
  임은혜,난청이라고 하면 평소에 듣는 음악이 더 작게들리거나 해야한다고 생각이 들었는데요~ 저는 왜 어느날은 평소보다 작은 소리 음악에도 엄청 크게 울리는 걸까요.. 이것도 문제인가요ㅠㅠㅠ
  MINO,유익하네요ㅜㅜ  요즘 고생 중인데
  Lakas,"선천적으로 못들어서 인공와우 이식 수술을 받게 된다면 성장하면서 머리가 커질텐데, 이식했던 인공와우도 재수술이나 시술을 통해 교체를 해줘야 되는 건가요? 궁금하네요."
  꽃보다 은우,건설업( 시끄러운 환경)에 계셨지만 젊을때는 그래도 일상생활에 지장은 없으셨는데~40대는 집에 tv볼륨을 최대치로 들으셔야되고 50대는 뇌종양 수술후로는 급격히 안좋아져서 일상생활에서 대화가 어렵고 가족들외에는 항상 한번씩 되묻는경우가 빈번해져서 실수하시거나 하는 불편함을 느끼는경우가 많더라구요  검진 받으라고 여러차례 말씀드렸는데 ;; 이게 본인이 늙어서 그렇다? 그리고 보청기 끼는게 불편하고 노인된거같다고 생각하셔서 그런지 계속 거부 하다가60대 뇌종양이 재발되서 방사선치료하다  이비인후과 진료보시구 선천적 요인 + 그리고 환경적 요인 등때문에 발생한 귀질환이라서 수술치료 가능하다고 하셔서 이번달에 한쪽귀 내년에 반대쪽귀 수술 예정입니다tv볼륨을 너무 크게 키우지 않는지 일상생활에서 커뮤니케이션이나 이런부분에 어려움 겪는분 예를 들어 은행업무나 병원가면 직원분들 설명들으신걸 한번에 처리를 못해서 직원분이 보호자를 찾거나혼자 방문시에는 처리를 못해서 두번 방문하거나 해야되더라구요 특히 코로나로 마스크쓰면서 더 심해진거 같은데 이런분이시거나 부모님이 계시면 꼭 병원검진 필요한거같아요~저도 단순히 자연스런 노화 과정으로 치부할뻔했거든요 ~~수술결정을 내리고서야 아빠가 평소에 직장에서도 힘들었다 하시는데 좀더 일찍 병원갈걸 후회중이네요
  lolmoonlolv문,난청으로 병원에 갔는데 돌발성난청이 왔을때 바로 오는 경우 아니면 치료가 불가능하다고 하시던데 영상에서는 난청치료를 받아야 한다고 하시네요. 어떤 치료가 이뤄지나요?
  JJ K,"전 이명있어서 병원가서 이것저것 검사해보더니 난청이 왔다가 나았다고 하더라고욬ㅋㅋㅋㅋ 그래서 눼? 정확히 무슨 검사였는지 기억안나는데 저 의자에 뱅글뱅글 돌려보고 무슨 그래프보고 말씀하셨어요. 아니근데 난청이 언제어떻게 왔다가 가신건지 선생님께서 정확히 말안해주셨어… 선생님 영한, 막 개업하신분같았는데 기술설명자체에 너무 신이나셔서 제대로 물어보지도 못하고 그래프 설명만 듣다가 나옴 ㅠ"
  송주영,사람 많을 때 나는 소음 속 소리와 전화소리를 잘못들었는데 이 증상이 큰 상관없어보이는 우울증 치료이후 이 증상이 많이 완화 됐더라구요. 신기해서 적어보고가여
  성하,80세는 80프로가 난청이라니 ㄷㄷ 무섭네
  Soeun Lee,저만 그런지 모르는데 저는 듣고 한 2-3초 뒤에 이해가 되거나 아니면 소리는 들리는데 뭐라고 하는지 모르는 때가 많아요. 청력검사하면 정상으로 나오고요.. 혹시 이건 정신과에 관련된 문제일까요? 아니면 뇌 문제일까요ㅠㅠ 사회생활에 너무 불편해요
  노아,드럼치는데 귀마개 꼭 해야겠네요..
  해파리,어라...병원 가봐야되겠다ㅋㅋㅋㅋ영어듣기평가 이런건 괜찮은데 일반 대화에서 종종 에러남...
  gold ingot,20~30대에도 가끔 난청이 있는 사람들은 아마 군대에서 원인이 생겻지 않았을까 하는 생각도 듭니다 그게 아니라면 스트레스??
  바다선인장,한쪽 귀만 중등도 난청인데 치매 위험 관련있을까요? 이소골 뼈가 녹아서 수술적인 방법뿐인듯한데 아직 망설여지네요ㅜ 가벼운 수술일까요?
  하유랑,메니에르때매 난청이 생겨서 계속 치료받고있는데 호전은 없고 돌발성난청생겼다 이명생겼다 계속 반복하고ㅠ 흑흑...ㅜㅜ
  송은지,항생제도 함부로 먹으면 안되는구나!! ㅠㅠ
  쿠쿠루봉봉,이선균씨 목소리 좋은데 잘못알아들어서 넷플 자막키고 봐요. 친구랑 전화하다가도 발음이 웅얼웅얼 뭉개져서 들릴 때 있구요. ㅜㅜ
  권순우,"안녕하세요 혈액형 관련질문하나 드립니다 제가 잘못이해한 부분이있을수있어 블로그에 혈액형 검사결과 올려두었습니다 (링크때문에 댓글이 삭제돼서 링크는 못올리고 네이버블로그 아이디검색에 chldusqns 검색해서 봐주세요 죄송합니다ㅠㅠ) 저는 제 혈액형이 O negative 라고 알고있다가 얼마전 첫 헌혈을 하면서 혈액검사를 진행했습니다 몇일뒤 검사결과가 나왔는데 결과화면이 명확하지않아 헷갈리지만 제가봤을때 abo 아형, Rh negative weak D 형 이 나왔다는것 같습니다 그래서 궁금한점이 1. abo 검사에서 아형이 나왔으면 제 혈액형은 O형이 아닌건가요 2. Rh negative는 D 항원이 없다는것으로 알고있는고 Rh weak D 형은 D항원이 양적이나 질적으로 특이한점이 있다는걸로 알고있는데 Rh negative 이면서 Rh weak D 형일수 있는건가요?"
  전희서(파란큐빅),"정상 청력에서 100데시벨 까지떨어진 상태에서 인공와우 수술 3년차예요수술 안 했으면 진짜 어떻게 살았을지;;과학, 의료 기술 발달과 전자 기기 발전까지 현재 적용 할 수 있는 모든 기술 대통합이예요!!궁금한거 있으시면 물어 보세요"
  나천재야알아,   아빠  엄마  소음현장작업근로자분들  운전예민   민감  고난이도작업자 우울증   가족들  나빠지지않게 가족챙기기   노화를켜지말고지금있는나를지켜
  린크,청력검사는 정상수치보다 높아서 귀가 엄청 좋다고하는데 난청이... ㅠ 뭐 말을해도 잘 안들리고.. 집중력문제인가
  고앵,항생제라면.... 제가 페니실린 쇼크가 온 적이 있는데 그게 원인이 될 수도 있는 걸까요?
  미호_miho,전 태어날때마다 난청을 가지고 태어나서 청력 장애인이라고 했었다고 하네요 지금은 보청기 가지고 껴서 다니고 있습니다(넘 불편해)
  주성유,저는 이십대부터 난청이 와서 지금도 소리를 잘 못듣고 불편한데요... ㅠㅠ 치매까지 연관되있다니....일부러 이어폰 요즘에 잘 안끼고있습니다.. 한달에 네다섯번 낄까말까 하네요 무서워요 난청 ㅠㅠ
  이건못참지,"제목에 ""원인가"" -> ""원인과"" 아닌가요?"
  쌤최고,안녕하세요 닥터프렌즈 쌤들 헬프님들 
  은은,저는 사오정이에요ㅠㅠ 좀 시끌시끌한 곳에서 바짝 집중해서 들어도 잘못알아들어오ㅜㅜ
  林,2:43 헐 검사 받아봐야겠네요
  이지후,코르캐쉬 치매설 ㄷㄷ
  sdgerer85,ㅋㅋㅋㅋㅋㅋㅋㅋㅋㅋ짱잼인디
  김보람,낙준샘 왜 살이 계속빠지시나요 ㅜ ㅜ
  애덕생,우왕..
  이루리,제목 오타났어용!
  진서,자막이 너무 작아요우……
  나천재야알아,항생제 먹고 죽을뻔했어요
  애덕생,난청이 뭐ㅈ
  ㅇㅇ,3:25 어? 영험하구나
  크로아탐,와... 나이팅게일 그냥 간호사 위인 정도로만 생각했었는데 의료의 역사에 한 획을 그은 엄청난 사람이였구나....
  글피부터,오오..나이팅게일이 실질적으로 어떤 역할을 했었는지 이 영상에서 처음 알았어요! 초등학생때 얇은 위인전에서 대충 읽은 게 다라.. 자세한 얘기는 전혀 몰랐는데 나이팅게일 같은 분들에 대해 더 많이 이야기 듣고싶어요 ><
  안건희,썸네일 보이면 의학의 역사가 궁금해서 들어오는게 아니라 ㄹㅇ 어이없어서 들어옴ㅋㅋㅋㅋㅋㅋㅋㅋㅋ
  H Lee,와ㅋㅋㅋㅋ 의학의 역사는 모아서 엮어가지고 책으로 따로 내도 너무 재미있을 것 같아요ㅋㅋㅋㅋㅋ오늘도 의학의 무구한 발전에 감사하네요ㅠㅠ
  누스,어마어마하게 충격적인 내용이였네요지금은 위생이 건강의 기본이라고 배우지만 그게 19세기도 지나 20세기에서야 겨우 정착된거였군요오늘도 현대 의학발전에 감사하며 몰입해서 봤습니다.재밋는 영상 항상 감사합니다!
  민재김,"6:03 진짜 이집트는 고대시대떄는 엄청난 문명이었구나라는 걸 다시한번 느낍니다. 의학의 역사하면 빠지지않고 나오고 평민(중산층?)이 ""꿀""이나 기름을 ""상처에"" 바르고 ""붕대""를 감을 정도였다니 ㄷㄷ"
  청장미,와.. 진짜 역사에 이름을 남긴 사람은 대단하네요 사망률을 40%에서 2%까지ㄷㄷ
  조아라,나이팅게일이 진짜 대단하신 분이었구나 단순히 마음만 선한게 아니라 강한 마음과 냉철한 이성을 가지신 분이었네
  이채영,예전엔 과거로 돌아가서 전쟁을 막을수 있다면 막연히 좋기만 하지 않을까 했는데 의학의 역사 시리즈 볼때마다 그때 발전한 의학법이 많다는 걸 보고 기분이 묘해져요..
  자몽에이드,다치면 대충 물로씻고 연고바르고 밴드 붙였는데 이게 엄청나게 진보된 의학의 산물이었던거네요...
  JJ K,와 진짜 간단한 치료도 이렇게 수많은 희생으로 우리가 누리는 거라니ㅠㅠ 미래에 우리가 현재하는것중에서 어처구니없는 치료들은 뭐가될지 궁금하기도하네요.
  HEYJUDE,세상에.. 절단하고 끓는기름...... 경악을 금치 못하며 봤습니다ㄷㄷ 의학의 역사 시리즈 정말 유익하고 재밌어요. 골절의 역사는 또 얼마나 경악스러울지 궁금하면서도 기대가 되네요
  javaxer jack,"몇 가지 수정하자면, 도끼가 아니라 통상 톱으로 잘랐습니다.(그냥 목공용 톱) 시간이 더 걸린다는 점에서는 더 고통스러운 치료였고 영상에서 지적한 감염 문제로 대부분 사망했습니다.외과 수술을 의사가 직접 집도해야 한다는 발상도 그렇게 오래된 발상이 아닙니다. 그 전에는 이발소나 도살장의 도축자가 절단 작업을 했고 의사는 이걸 하면 안된다고 생각하는 이상한 풍조가 있었습니다.(이발소의 3색 회전 마크는 붕대, 동맥, 정맥을 상징하는 겁니다)"
  원_85,"닥프 너무 잘보고 있어요!!의학의 역사는 특히 재밌어요몇백년뒤에는 사람들이 ""야...21세기까지 암에 걸리면 방사선을 쏘고 머리빠지는 약을 줬대..""이러는거 상상하면 더 재밌어요!!"
  은또기,저는 간호사인데요 ㅎㅎ 의학의 주제로 긴 역사를 간략히 재미있게 설명해주시어 넘넘 재밌게 잘 듣고있어욥^^간호학 의학적 수업만 들어봤지 이렇게 의학의 방대한 역사를 접근해본적은 없어서정말 유익하고 재밌어요 ^^그리고 현대의학에 대해 더욱 감사함을 느끼게 되네요 
  모찌섭,최근에 의학의 역사 다 정주행하고 이거 나올 때만 기다리고 있었는데 알람 뜨자마자 바로 들어옴. 진짜 지금 시대에 태어난게 천운인걸 다시 한 번 느끼고감...글구 우창윤 선생님 고통받아 하시는게 넘 웃김ㅋㅋㅋㅠㅠ
  POB,의학의 역사보면 볼 수록.. 예전엔 자연사가 진짜 최고의 축복이었네요.
  그머시기,"와...너무 충격적이다.. 옛날 의학이 끔찍했다라는 것은 닥프 많이 보면서 그렇구나 했는데 중세시대나 19세기, 저 시대까지도 상처치료를 제대로 못해서 조그만 상처에도 죽는다는게 너무 충격적이야.."
  ㄴㄴ,오늘도 고통받는 창윤쌤…ㅋㅋㅋㅋㅋ의학의 역사 볼 때마다 창윤쌤 반응 너무 재밌어요
  바나야,"낙준쌤 안녕하세요! 닥프 의학의역사가 인생의 유일한 낙인 수능2주 남은 학생입니다 :) 진짜 요즘 너무 힘든데, 닥프에서 의학의 역사 컨텐츠 올라오는 날이면 '얼른 공부 끝내고 집 가서 맛있는거 먹으면서 의학의 역사 봐야징~~' 하면서 힘내는거 같아요ㅠ 네이버시리즈에 연재 시작하셨다고 들었는데 웹툰이나 웹소설은 수능 준비하면서 다 끊어서 얼른 수능 끝나고 네이버시리즈 정주행 가겠습니다! 항상 좋은 퀄리티의 재밌는 영상 제작해주셔서 감사합니다"
  바나나,의학의 역사 시리즈는 궁금해서 한번 눌러봤다가 계속 정주행하고 있는것같아요! 생각보다 흥미롭고 새로워서 더 다양한이야기를 듣고싶습니다 ㅎㅎ
  ᄒᄅ,의학의 역사는 우창윤 선생님 리액션 보는 맛에 보는 것 같아요ㅋㅋㅋㅋㅋㅋㅋ 편집고 재밌고 귀에 쏙쏙 들어와서 업로드 될 때마다 보게 되네요!
  the goodness,골절의 역사도 빨리 보고싶어요! 저는 의학의 역사만 기다려요 ㅎㅎㅎ 특히 선생님들의 리얼한 리액션이 재밌어서 더 좋아요
  강느낌표,후세에 치료법을 전승해준 선조님들께 정말 감사합니다ㅠㅠ
  manimani,근데 진짜 치료와 전쟁의 역사는 서로 뗄레야 뗄 수가 없는 관계네
  문연경,서양의 의학 역사다 보니 동양의 의학 역사와 비교해서도 들어보고 싶어요!! 화타 정약용 닽은 인물들도있고 대부분 동양의 의학은 상처치료 위주로만 알고 있어서 궁금해요!!
  zee43a,나이팅게일하면 백의의 천사정도만 알고 실제 업적에 대해서는 잘 알지 못했는데. (소독의 개념을 중시했다는 게 막 와닿지 않았음....21세기 현대인에겐 너무 당연한 개념이라서) 상처 치료의 역사를 알고 나니 얼마나 위대하신 분인지 깨닫게 됐습니다. 들으면 들을수록 진짜 의학 발전을 감사하게 여기게 됩니다.... 세상에 산화 납 구리 청동을 상처 부위에 바른다니
  게임하는알파카,서구권의 역사도 어마어마하네요 ㄷㄷ혹시 한국 등의 아시아권에서는 어땠을까요? 생각해보니 사극에서는 침이나 약만 먹고 찰과상이나 자상 치료하는 건 전혀 못봤던거 같은데 인도나 중국같은 곳들도 그랬을까요??
  Su_Zy,역시 강한 자들만 살아남을 수 있는 옛날
  핑크헤드,고통이 있는 부위를 썩어 없애어 다시는 고통받지 않게 한다라...여윽시 우리 조상님들은 위대해!!!!
  우정,외국의 자극적이고 충격적인 역사도 너무너무 재밌지만 동의보감이나 민간요법 같은 우리나라의 의학 역사도 궁금해요 !!
  동그리,매번 새로운 의학의 역사...선생님들 이거 평생 해주세요ㅠㅠ너무 새로워서 질리지가 않아요ㅋㅋㅋㅋㄷㄷㄷ
  문소연,의학의 역사 항상 너무 잘 보고 있습니다나이팅게일 천사같은 간호사인줄 알았는데 어마어마한 공을 세운 분이셨네요재밌는 영상 감사합니다!
  예지,의학역사 시리즈 너무 재밌어서 정주행했어요ㅜㅜ 매 에피소드마다 정성다해서 준비해오시는 낙준쌤께 박수를
